{
  "$schema": "http://json-schema.org/draft-07/schema#",
  "$id": "https://registry.davoranic.com/schema/theme.json",
  "title": "Theme adapter",
  "description": "A design system's character expressed as values for the semantic contract, plus its capability declaration. Adapters are read-only portraits of their source (docs/LINKING.md R3).",
  "type": "object",
  "required": ["name", "title", "capabilities", "tokens"],
  "properties": {
    "$schema": { "type": "string" },
    "name": { "type": "string", "pattern": "^[a-z][a-z0-9-]*$" },
    "title": { "type": "string" },
    "description": { "type": "string" },
    "sourceRef": { "type": "string", "description": "<repo>@<version|commit> — which sitting this portrait was painted from" },
    "contract": { "type": "string", "description": "semver of the contract this adapter conforms to" },
    "capabilities": {
      "type": "object",
      "properties": {
        "modes": { "type": "array", "items": { "enum": ["light", "dark"] } },
        "density": { "oneOf": [ { "const": false }, { "type": "object", "required": ["options", "default"] } ] },
        "corner": { "enum": ["knob", "fixed-sharp", "fixed-rounded"] },
        "iconSets": { "oneOf": [ { "type": "array" }, { "type": "object" } ] },
        "fonts": { "type": "array", "items": { "type": "string" } }
      }
    },
    "constraints": { "type": "array", "items": { "type": "string" }, "description": "What this theme does NOT permit — visible, never hidden" },
    "tokens": { "type": "object", "description": "Values for the contract slots, by mode and category" },
    "variantMaps": { "type": "object", "description": "Canonical axis cells -> this system's variant names, plus declared fallbacks" },
    "anatomySpecific": { "type": "array", "items": { "type": "string" }, "description": "Components whose structure exists only in this system" }
  }
}
